{
  "$schema": "./story.schema.json",
  "story": {
    "id": "eindhoven-evening-demonstration",
    "title": "Evening demonstration in the city centre",
    "standfirst": "A fictional march for safer night cycling in Eindhoven, from the Markt to the Stadhuis.",
    "byline": "Storyline Demo Desk",
    "date": "2026-09-25",
    "timezone": "Europe/Amsterdam",
    "start": "18:00",
    "end": "23:00",
    "place": "Central Eindhoven",
    "fictional": true,
    "disclaimer": "Fictional demo scenario. The demonstration, times, crowd figures, quotes, people and sources are all invented. Only the street names and the map are real."
  },
  "chapters": [
    {
      "id": "c1",
      "title": "Gathering on the Markt",
      "start": "18:00",
      "summary": "People with bike lights and paper lanterns gather on the Markt. Organisers speak from a small stage at the north end of the square.",
      "camera": {
        "target": [
          5.47852,
          51.43935
        ],
        "zoom": 2.15
      }
    },
    {
      "id": "c2",
      "title": "The march sets off",
      "start": "19:10",
      "summary": "The crowd leaves the Markt heading north along Demer and loops across 18 Septemberplein, then down the Vestdijk.",
      "camera": {
        "target": [
          5.4795,
          51.4404
        ],
        "zoom": 1.55
      }
    },
    {
      "id": "c3",
      "title": "Through Stratumseind",
      "start": "19:45",
      "summary": "Via Ten Hagestraat the march reaches Catharinaplein in front of the church, then heads down Stratumseind towards the Stadhuis.",
      "camera": {
        "target": [
          5.4811,
          51.4368
        ],
        "zoom": 1.7
      }
    },
    {
      "id": "c4",
      "title": "Closures and diversions",
      "start": "20:10",
      "summary": "As the march nears the Stadhuis, the Wal is closed to traffic and buses are diverted along the Vestdijk and Geldropseweg.",
      "camera": {
        "target": [
          5.482,
          51.4362
        ],
        "zoom": 1.12
      }
    },
    {
      "id": "c5",
      "title": "At the Stadhuis",
      "start": "20:30",
      "summary": "The crowd builds up outside the Stadhuis. Organisers and the municipality give very different estimates of its size.",
      "camera": {
        "target": [
          5.4803,
          51.43545
        ],
        "zoom": 2
      }
    },
    {
      "id": "c6",
      "title": "Dispersal and reopening",
      "start": "21:45",
      "summary": "Organisers close the event. People leave in several directions, the Wal reopens and buses return to their normal routes.",
      "camera": {
        "target": [
          5.4802,
          51.4356
        ],
        "zoom": 1.35
      }
    }
  ],
  "sources": [
    {
      "id": "s-reporter",
      "name": "Storyline reporter on scene",
      "type": "reporter",
      "reliability": "high",
      "note": "First-hand observation, time-stamped. The reporter is fictional."
    },
    {
      "id": "s-photo",
      "name": "Storyline photo desk",
      "type": "photo",
      "reliability": "high",
      "note": "Geolocated, time-stamped photos. Used for the crowd counts."
    },
    {
      "id": "s-traffic",
      "name": "Municipal traffic feed",
      "type": "data",
      "reliability": "high",
      "note": "Automated road-status feed. Simulated for this demo."
    },
    {
      "id": "s-bus",
      "name": "Bus operator service notice",
      "type": "official",
      "reliability": "medium",
      "note": "Notices can lag what happens on the street by several minutes. Simulated."
    },
    {
      "id": "s-organisers",
      "name": "Organisers’ statements",
      "type": "organiser",
      "reliability": "medium",
      "note": "An involved party. Their crowd figures are not independently checked. The collective is fictional."
    },
    {
      "id": "s-livestream",
      "name": "Organisers’ livestream",
      "type": "video",
      "reliability": "medium",
      "note": "Shows mostly the front of the march, so the framing is selective. Fictional."
    },
    {
      "id": "s-municipality",
      "name": "Municipality press office",
      "type": "official",
      "reliability": "medium",
      "note": "Official estimate. The counting method was not published. Fictional statement."
    },
    {
      "id": "s-firstaid",
      "name": "First-aid volunteers",
      "type": "organisation",
      "reliability": "high",
      "note": "Volunteer first-aid team at the event. Fictional."
    },
    {
      "id": "s-eyewitness",
      "name": "Eyewitness (resident)",
      "type": "eyewitness",
      "reliability": "medium",
      "note": "A single account by phone, not yet corroborated. Fictional person."
    },
    {
      "id": "s-social",
      "name": "Social media posts",
      "type": "social",
      "reliability": "low",
      "note": "Unverified posts. Their original time and place could not be established."
    }
  ],
  "events": [
    {
      "id": "e1",
      "time": {
        "start": "18:05",
        "end": "19:45"
      },
      "title": "Crowd gathers on the Markt",
      "summary": "People carrying bike lights and paper lanterns arrive on the Markt in small groups. By just after seven the square is close to full.",
      "type": "gathering",
      "place": "Markt",
      "location": {
        "type": "area",
        "coordinates": [
          [
            5.479004,
            51.438961
          ],
          [
            5.478536,
            51.439834
          ],
          [
            5.478222,
            51.439769
          ],
          [
            5.478161,
            51.439513
          ],
          [
            5.478311,
            51.439205
          ],
          [
            5.478525,
            51.438862
          ],
          [
            5.479004,
            51.438961
          ]
        ]
      },
      "crowd": {
        "estimate": 1400,
        "low": 1000,
        "high": 1900,
        "series": [
          {
            "time": "18:05",
            "estimate": 60,
            "low": 40,
            "high": 90
          },
          {
            "time": "18:25",
            "estimate": 400,
            "low": 300,
            "high": 550
          },
          {
            "time": "18:45",
            "estimate": 1100,
            "low": 800,
            "high": 1500
          },
          {
            "time": "19:05",
            "estimate": 1400,
            "low": 1000,
            "high": 1900
          },
          {
            "time": "19:15",
            "estimate": 1200,
            "low": 900,
            "high": 1600
          },
          {
            "time": "19:30",
            "estimate": 250,
            "low": 150,
            "high": 400
          },
          {
            "time": "19:45",
            "estimate": 0,
            "low": 0,
            "high": 0
          }
        ]
      },
      "confidence": "confirmed",
      "confidenceNote": "Seen by our reporter. Numbers come from geolocated photos taken at 18:45 and 19:05.",
      "sources": [
        {
          "source": "s-reporter",
          "timestamp": "18:07",
          "detail": "First groups arrive at the north side of the square.",
          "link": "https://example.com/placeholder/reporter-1807"
        },
        {
          "source": "s-photo",
          "timestamp": "19:05",
          "detail": "Overhead photo used for the crowd count.",
          "link": "https://example.com/placeholder/photo-1905"
        }
      ]
    },
    {
      "id": "e2",
      "time": "18:40",
      "title": "Organisers address the crowd",
      "summary": "From a small stage at the north end of the square, a speaker for the organisers calls for better-lit cycle routes through the centre.",
      "type": "statement",
      "place": "Markt, north side",
      "location": {
        "type": "point",
        "coordinates": [
          5.478386,
          51.439774
        ]
      },
      "quote": {
        "text": "We just want to get home safely after dark.",
        "attribution": "Speaker for the organisers (invented quote)"
      },
      "confidence": "confirmed",
      "confidenceNote": "Recorded by our reporter. The wording matches the organisers’ livestream.",
      "sources": [
        {
          "source": "s-reporter",
          "timestamp": "18:41",
          "detail": "Audio recording of the speech.",
          "link": "https://example.com/placeholder/reporter-1841"
        },
        {
          "source": "s-livestream",
          "timestamp": "18:40",
          "detail": "Livestream segment of the speech.",
          "link": "https://example.com/placeholder/livestream-1840"
        }
      ]
    },
    {
      "id": "e3",
      "time": {
        "start": "19:12",
        "end": "19:47"
      },
      "title": "March sets off towards 18 Septemberplein",
      "summary": "The crowd leaves the Markt heading north along Demer, then loops across 18 Septemberplein, past the Blob, and turns down the Vestdijk.",
      "type": "movement",
      "place": "Demer → 18 Septemberplein → Vestdijk",
      "location": {
        "type": "path",
        "snap": "streets",
        "anchor": [
          5.47715,
          51.4402
        ],
        "via": [
          [
            5.478386,
            51.439774
          ],
          [
            5.4775,
            51.43932
          ],
          [
            5.47715,
            51.4402
          ],
          [
            5.47681,
            51.44108
          ],
          [
            5.47687,
            51.44137
          ],
          [
            5.47791,
            51.44151
          ],
          [
            5.47842,
            51.44105
          ],
          [
            5.48235,
            51.43814
          ]
        ],
        "coordinates": [
          [
            5.478482,
            51.439823
          ],
          [
            5.477929,